exercise_id,name,complexity_level,primary_equipment,target_muscles,secondary_muscles,body_parts,total_muscle_groups,gif_url,instructions,cardiovascular_endurance_score,muscular_strength_score,muscular_hypertrophy_score,power_development_score,functional_movement_score,calorie_expenditure_score,flexibility_mobility_score,balance_coordination_score,metabolic_conditioning_score,progressive_overload_score,primary_training_category,maintain_weight_compatibility,lose_weight_compatibility,gain_weight_compatibility,build_muscle_compatibility,improve_fitness_compatibility,sedentary_suitability,lightly_active_suitability,moderately_active_suitability,very_active_suitability,extremely_active_suitability,overall_quality_score
hTLtkXL,Resistance Band Seated Shoulder Press With Declined,2,resistance band,delts,"triceps, upper back",shoulders,3,https://static.exercisedb.dev/media/hTLtkXL.gif,"Step:1 Sit on a chair or bench with your back straight and feet flat on the ground. | Step:2 Hold the resistance band with both hands, palms facing forward, and bring it up to shoulder level. | Step:3 Press the band overhead, extending your arms fully. | Step:4 Pause for a moment at the top, then slowly lower the band back down to shoulder level. Emphasize declined control. | Step:5 Repeat for the desired number of repetitions.",0.0,8.5,7.5,0.0,8.0,6.0,0.0,0.0,0.0,9.0,Strength Training,3.8,3.9,7.0,7.0,3.8,7.0,8.0,6.0,5.0,3.0,4.5
EnPivTL,Barbell Bent Arm Pullover - Powerful Variation,2,barbell,lats,"triceps, chest",back,3,https://static.exercisedb.dev/media/EnPivTL.gif,"Step:1 Lie flat on a bench with your head at one end and your feet on the floor. | Step:2 Hold a barbell with a shoulder-width grip and extend your arms straight above your chest. | Step:3 Lower the barbell behind your head while keeping your arms slightly bent. | Step:4 Pause for a moment, then raise the barbell back to the starting position. | Step:5 Repeat for the desired number of repetitions. Focus on powerful movement.",0.0,8.5,7.5,0.0,8.0,6.0,0.0,0.0,0.0,9.0,Strength Training,3.8,3.9,7.0,7.0,3.8,6.0,8.0,6.0,6.0,4.0,4.5
MRaFiZP,Inverted Style Smith Seated Shoulder Press,3,smith machine,delts,"triceps, upper back",shoulders,3,https://static.exercisedb.dev/media/MRaFiZP.gif,"Step:1 Adjust the seat height so that the handles are at shoulder level. | Step:2 Sit on the machine with your back against the pad and your feet flat on the floor. | Step:3 Grasp the handles with an overhand grip and lift them off the supports, extending your arms fully. | Step:4 Lower the handles down to shoulder level, keeping your elbows slightly bent. | Step:5 Press the handles up overhead until your arms are fully extended. | Step:6 Pause for a moment at the top, then slowly lower the handles back down to shoulder level. Maintain inverted form throughout. | Step:7 Repeat for the desired number of repetitions.",0.0,8.5,7.5,0.0,8.0,6.0,0.0,0.0,0.0,9.0,Strength Training,3.8,3.9,7.0,7.0,3.8,5.0,7.0,7.0,7.0,6.0,4.5
G1qWW6M,Macro Style Weighted One Hand Pull Up,3,weighted,lats,"biceps, forearms",back,3,https://static.exercisedb.dev/media/G1qWW6M.gif,"Step:1 Grab the pull-up bar with an overhand grip, slightly wider than shoulder-width apart. | Step:2 Hang from the bar with your arm fully extended and your body straight. Perform with macro intensity. | Step:3 Engage your core and pull your body up towards the bar by bending your elbow and squeezing your back muscles. | Step:4 Continue pulling until your chin is above the bar. | Step:5 Lower your body back down to the starting position with control. | Step:6 Repeat for the desired number of repetitions.",0.0,8.5,7.5,0.0,8.0,6.0,0.0,0.0,0.0,9.0,Strength Training,3.8,3.9,7.0,7.0,3.8,6.0,7.0,7.0,6.0,5.0,4.5
izMnLqz,Dumbbell Alternate Side Press,2,dumbbell,delts,"triceps, core",shoulders,3,https://static.exercisedb.dev/media/izMnLqz.gif,"Step:1 Stand with your feet shoulder-width apart, holding a dumbbell in each hand at shoulder height. | Step:2 Press one dumbbell overhead while keeping the other dumbbell at shoulder height. | Step:3 Lower the pressed dumbbell back to shoulder height while pressing the other dumbbell overhead. | Step:4 Continue alternating sides for the desired number of repetitions.",0.0,8.5,7.5,0.0,8.0,6.0,0.0,0.0,0.0,9.0,Strength Training,3.8,3.9,7.0,7.0,3.8,8.5,8.0,6.0,5.0,3.0,4.5
bQHPBU3,Dumbbell One Arm Pullover On Exercise Ball,2,dumbbell,pectorals,"triceps, latissimus dorsi, rhomboids",chest,4,https://static.exercisedb.dev/media/bQHPBU3.gif,"Step:1 Sit on an exercise ball with your feet flat on the ground and your knees bent at a 90-degree angle. | Step:2 Hold a dumbbell with one hand and extend your arm straight up above your chest. | Step:3 Slowly lower the dumbbell behind your head while keeping your arm straight. | Step:4 Pause for a moment, then raise the dumbbell back to the starting position. | Step:5 Repeat for the desired number of repetitions, then switch arms.",0.0,8.5,7.5,0.0,8.0,6.0,0.0,0.0,0.0,9.0,Strength Training,3.8,3.9,7.0,7.0,3.8,8.5,8.0,6.0,5.0,3.0,4.5
7zdxRTl,Smith Leg Press,3,smith machine,glutes,"quadriceps, hamstrings, calves",upper legs,4,https://static.exercisedb.dev/media/7zdxRTl.gif,"Step:1 Adjust the seat and footplate of the smith machine to a comfortable position. | Step:2 Sit on the machine with your back against the backrest and your feet shoulder-width apart on the footplate. | Step:3 Grasp the handles or sides of the machine for stability. | Step:4 Push the footplate away from you by extending your legs, keeping your back against the backrest. | Step:5 Pause for a moment at the fully extended position. | Step:6 Slowly bend your knees and lower the footplate back towards you, returning to the starting position. | Step:7 Repeat for the desired number of repetitions.",0.0,8.5,7.5,0.0,8.0,6.0,0.0,0.0,0.0,9.0,Strength Training,3.8,3.9,7.0,7.0,3.8,5.0,7.0,7.0,7.0,6.0,4.5
UIbGx6H,Dumbbell Reverse Bench Press,3,dumbbell,pectorals,"triceps, shoulders",chest,3,https://static.exercisedb.dev/media/UIbGx6H.gif,"Step:1 Lie flat on a bench with your feet flat on the ground and your knees bent. | Step:2 Hold a dumbbell in each hand with an overhand grip, palms facing towards your feet. | Step:3 Extend your arms straight up towards the ceiling, keeping a slight bend in your elbows. | Step:4 Slowly lower the dumbbells towards your chest, allowing your elbows to flare out to the sides. | Step:5 Pause for a moment at the bottom, then push the dumbbells back up to the starting position. | Step:6 Repeat for the desired number of repetitions.",0.0,8.5,7.5,0.0,8.0,6.0,0.0,0.0,0.0,9.0,Strength Training,3.8,3.9,7.0,7.0,3.8,7.5,7.0,7.0,6.0,5.0,4.5
mym4hJo,Dumbbell Lying Pronation,2,dumbbell,forearms,"biceps, shoulders",lower arms,3,https://static.exercisedb.dev/media/mym4hJo.gif,"Step:1 Lie flat on a bench with your chest facing down and your arms extended straight down, holding a dumbbell in each hand. | Step:2 Rotate your palms so they are facing up. | Step:3 Keeping your upper arms stationary, exhale and curl the dumbbells as you rotate your palms to face down. | Step:4 Inhale and slowly lower the dumbbells back to the starting position. | Step:5 Repeat for the desired number of repetitions.",0.0,8.5,7.5,0.0,8.0,6.0,0.0,0.0,0.0,9.0,Strength Training,3.8,3.9,7.0,7.0,3.8,8.5,8.0,6.0,5.0,3.0,4.5
pH2x2jj,Dumbbell One Leg Fly On Exercise Ball,3,dumbbell,pectorals,"shoulders, triceps",chest,3,https://static.exercisedb.dev/media/pH2x2jj.gif,"Step:1 Sit on an exercise ball with a dumbbell in each hand, palms facing each other. | Step:2 Place one foot on the ground and extend the other leg straight out in front of you. | Step:3 Lean forward slightly and bring your arms out to the sides, keeping a slight bend in your elbows. | Step:4 Slowly lower the dumbbells down and out to the sides, feeling a stretch in your chest. | Step:5 Pause for a moment at the bottom, then squeeze your chest muscles to bring the dumbbells back up to the starting position. | Step:6 Repeat for the desired number of repetitions, then switch legs and repeat.",0.0,8.5,7.5,0.0,8.0,6.0,0.0,0.0,0.0,9.0,Strength Training,3.8,3.9,7.0,7.0,3.8,7.5,7.0,7.0,6.0,5.0,4.5
lJJ7Yq8,Cable Lying Fly,2,cable,pectorals,"deltoids, triceps",chest,3,https://static.exercisedb.dev/media/lJJ7Yq8.gif,"Step:1 Attach the handles to the cables and lie flat on a bench with your feet flat on the ground. | Step:2 Hold the handles with your palms facing each other and your arms extended straight above your chest. | Step:3 Keeping a slight bend in your elbows, lower your arms out to the sides in a wide arc until you feel a stretch in your chest. | Step:4 Pause for a moment, then squeeze your chest muscles to bring your arms back to the starting position. | Step:5 Repeat for the desired number of repetitions.",0.0,8.5,7.5,0.0,8.0,6.0,0.0,0.0,0.0,9.0,Strength Training,3.8,3.9,7.0,7.0,3.8,6.0,8.0,6.0,6.0,4.0,4.5
BLCvwr2,Dumbbell Reverse Wrist Curl,2,dumbbell,forearms,"biceps, brachialis",lower arms,3,https://static.exercisedb.dev/media/BLCvwr2.gif,"Step:1 Sit on a bench or chair with your feet flat on the ground. | Step:2 Hold a dumbbell in each hand with an overhand grip, palms facing down. | Step:3 Rest your forearms on your thighs, allowing your wrists to hang off the edge. | Step:4 Slowly curl your wrists upward, bringing the dumbbells towards your body. | Step:5 Pause for a moment at the top, then slowly lower the dumbbells back down to the starting position. | Step:6 Repeat for the desired number of repetitions.",0.0,8.5,7.5,0.0,8.0,6.0,0.0,0.0,0.0,9.0,Strength Training,3.8,3.9,7.0,7.0,3.8,8.5,8.0,6.0,5.0,3.0,4.5
L4ay0PW,Kettlebell Figure 8,3,kettlebell,abs,"shoulders, forearms",waist,3,https://static.exercisedb.dev/media/L4ay0PW.gif,"Step:1 Stand with your feet shoulder-width apart, holding a kettlebell in one hand. | Step:2 Bend your knees slightly and hinge forward at the hips, keeping your back straight. | Step:3 Pass the kettlebell between your legs, switching hands as it reaches the back of your legs. | Step:4 As the kettlebell comes forward, pass it to the other hand between your legs. | Step:5 Continue passing the kettlebell between your legs in a figure 8 motion. | Step:6 Maintain a steady pace and engage your core throughout the exercise. | Step:7 Repeat for the desired number of repetitions.",0.0,8.5,7.5,0.0,8.0,6.0,0.0,0.0,0.0,9.0,Strength Training,3.8,3.9,7.0,7.0,3.8,7.5,7.0,7.0,6.0,5.0,4.5
Ie9UGty,Lever Seated Calf Press,3,leverage machine,calves,"soleus, hamstrings",lower legs,3,https://static.exercisedb.dev/media/Ie9UGty.gif,"Step:1 Adjust the seat of the machine so that your shoulders are aligned with the lever pad. | Step:2 Place your toes on the lower portion of the platform and position your knees under the lever pad. | Step:3 Grasp the handles on the sides of the seat for stability. | Step:4 Press the lever pad down by extending your ankles, lifting your heels as high as possible. | Step:5 Pause for a moment at the top of the movement, then slowly lower your heels back down to the starting position. | Step:6 Repeat for the desired number of repetitions.",0.0,8.5,7.5,0.0,8.0,6.0,0.0,0.0,0.0,9.0,Strength Training,3.8,3.9,7.0,7.0,3.8,6.0,7.0,7.0,6.0,5.0,4.5
fprd84i,Ez Barbell Anti Gravity Press,2,ez barbell,delts,"triceps, chest",shoulders,3,https://static.exercisedb.dev/media/fprd84i.gif,"Step:1 Start by standing with your feet shoulder-width apart and holding the ez barbell with an overhand grip. | Step:2 Raise the barbell to shoulder height, keeping your elbows slightly bent and your palms facing forward. | Step:3 Press the barbell overhead, extending your arms fully. | Step:4 Lower the barbell back to shoulder height and repeat for the desired number of repetitions.",0.0,8.5,7.5,0.0,8.0,6.0,0.0,0.0,0.0,9.0,Strength Training,3.8,3.9,7.0,7.0,3.8,7.0,8.0,6.0,5.0,3.0,4.5
yWxMvB5,Kettlebell Thruster,3,kettlebell,delts,"quadriceps, glutes, core",shoulders,4,https://static.exercisedb.dev/media/yWxMvB5.gif,"Step:1 Start by standing with your feet shoulder-width apart, holding a kettlebell in front of your chest with both hands, palms facing each other. | Step:2 Lower into a squat position by bending your knees and pushing your hips back, keeping your chest up and your back straight. | Step:3 As you reach the bottom of the squat, explosively drive through your heels to stand up, simultaneously pressing the kettlebell overhead. | Step:4 Lock out your arms at the top of the movement, fully extending your elbows. | Step:5 Lower the kettlebell back to the starting position by reversing the movement, bending your elbows and lowering the weight back to your chest. | Step:6 Repeat for the desired number of repetitions.",0.0,8.5,7.5,0.0,8.0,6.0,0.0,0.0,0.0,9.0,Strength Training,3.8,3.9,7.0,7.0,3.8,7.5,7.0,7.0,6.0,5.0,4.5
za9Ni4z,Barbell Rack Pull,3,barbell,glutes,"hamstrings, lower back",upper legs,3,https://static.exercisedb.dev/media/za9Ni4z.gif,"Step:1 Set up a barbell on a rack at knee height. | Step:2 Stand with your feet shoulder-width apart, toes pointing slightly outwards. | Step:3 Bend at the hips and knees to lower yourself down and grip the barbell with an overhand grip, hands shoulder-width apart. | Step:4 Engage your core and lift the barbell by extending your hips and knees, pulling your shoulders back and squeezing your glutes at the top. | Step:5 Lower the barbell back down to the starting position by bending at the hips and knees. | Step:6 Repeat for the desired number of repetitions.",0.0,8.5,7.5,0.0,8.0,6.0,0.0,0.0,0.0,9.0,Strength Training,3.8,3.9,7.0,7.0,3.8,5.0,7.0,7.0,7.0,6.0,4.5
S93zLTG,Resistance Band Seated Shoulder Press,2,resistance band,delts,"triceps, upper back",shoulders,3,https://static.exercisedb.dev/media/S93zLTG.gif,"Step:1 Sit on a chair or bench with your back straight and feet flat on the ground. | Step:2 Hold the resistance band with both hands, palms facing forward, and bring it up to shoulder level. | Step:3 Press the band overhead, extending your arms fully. | Step:4 Pause for a moment at the top, then slowly lower the band back down to shoulder level. | Step:5 Repeat for the desired number of repetitions.",0.0,8.5,7.5,0.0,8.0,6.0,0.0,0.0,0.0,9.0,Strength Training,3.8,3.9,7.0,7.0,3.8,7.0,8.0,6.0,5.0,3.0,4.5
KwFGiEP,Dumbbell Lying One Arm Rear Lateral Raise,1,dumbbell,delts,"traps, rhomboids",shoulders,3,https://static.exercisedb.dev/media/KwFGiEP.gif,"Step:1 Lie face down on a flat bench with a dumbbell in one hand, hanging towards the floor. | Step:2 Keep your arm straight and lift the dumbbell out to the side, away from your body. | Step:3 Pause for a moment at the top, then slowly lower the dumbbell back down to the starting position. | Step:4 Repeat for the desired number of repetitions, then switch to the other arm.",0.0,8.5,7.5,0.0,8.0,6.0,0.0,0.0,0.0,9.0,Strength Training,3.8,3.9,7.0,7.0,3.8,9.5,7.0,5.0,3.0,3.0,4.5
O8o7q4d,Dumbbell Press On Exercise Ball,3,dumbbell,pectorals,"shoulders, triceps",chest,3,https://static.exercisedb.dev/media/O8o7q4d.gif,"Step:1 Sit on an exercise ball with your feet flat on the ground and dumbbells in each hand, resting on your thighs. | Step:2 Slowly walk your feet forward, rolling the exercise ball until your lower back is supported on the ball and your knees are at a 90-degree angle. | Step:3 Raise the dumbbells to shoulder height, palms facing forward. | Step:4 Press the dumbbells upward until your arms are fully extended. | Step:5 Pause for a moment at the top, then slowly lower the dumbbells back to the starting position. | Step:6 Repeat for the desired number of repetitions.",0.0,8.5,7.5,0.0,8.0,6.0,0.0,0.0,0.0,9.0,Strength Training,3.8,3.9,7.0,7.0,3.8,7.5,7.0,7.0,6.0,5.0,4.5
IH2kr7n,Dumbbell Decline Shrug - Rigid Variation,2,dumbbell,traps,"shoulders, rhomboids",back,3,https://static.exercisedb.dev/media/IH2kr7n.gif,"Step:1 Set up a decline bench at a 45-degree angle. | Step:2 Lie face down on the bench with your chest and stomach resting against it. | Step:3 (rigid variation) Hold a dumbbell in each hand with your arms fully extended towards the floor. | Step:4 Keeping your arms straight, raise your shoulders towards your ears as high as possible. | Step:5 Hold the contraction for a moment, then slowly lower the dumbbells back to the starting position. | Step:6 Repeat for the desired number of repetitions.",0.0,8.5,7.5,0.0,8.0,6.0,0.0,0.0,0.0,9.0,Strength Training,3.8,3.9,7.0,7.0,3.8,8.5,8.0,6.0,5.0,3.0,4.5
QoSZo2Y,Cable One Arm Incline Press With Rigid,3,cable,pectorals,"deltoids, triceps",chest,3,https://static.exercisedb.dev/media/QoSZo2Y.gif,"Step:1 Adjust the cable machine to a low pulley position. | Step:2 Sit on an incline bench facing away from the cable machine. | Step:3 Grasp the handle with one hand and bring it up to shoulder height. Emphasize rigid control. | Step:4 Position your feet firmly on the ground and maintain a stable position. | Step:5 Press the handle forward and upward, extending your arm fully. | Step:6 Pause for a moment at the top, then slowly lower the handle back to the starting position. | Step:7 Repeat for the desired number of repetitions, then switch sides.",0.0,8.5,7.5,0.0,8.0,6.0,0.0,0.0,0.0,9.0,Strength Training,3.8,3.9,7.0,7.0,3.8,5.0,7.0,7.0,7.0,6.0,4.5
1TkiAFK,Dumbbell One Arm Shoulder Press V. 2,2,dumbbell,delts,"triceps, upper back",shoulders,3,https://static.exercisedb.dev/media/1TkiAFK.gif,"Step:1 Stand with your feet shoulder-width apart and hold a dumbbell in one hand at shoulder level, palm facing forward. | Step:2 Engage your core and press the dumbbell straight up overhead, fully extending your arm. | Step:3 Pause for a moment at the top, then slowly lower the dumbbell back to shoulder level. | Step:4 Repeat for the desired number of repetitions, then switch to the other arm.",0.0,8.5,7.5,0.0,8.0,6.0,0.0,0.0,0.0,9.0,Strength Training,3.8,3.9,7.0,7.0,3.8,8.5,8.0,6.0,5.0,3.0,4.5
TBNaSNs,Ez Barbell Decline Close Grip Face Press - Mini Variation,3,ez barbell,triceps,"chest, shoulders",upper arms,3,https://static.exercisedb.dev/media/TBNaSNs.gif,"Step:1 Lie on a decline bench with your head lower than your feet. | Step:2 Grasp the ez barbell with a close grip, palms facing each other. | Step:3 Extend your arms straight up above your chest, keeping your elbows close to your body. | Step:4 Lower the barbell towards your forehead by bending your elbows. | Step:5 Pause for a moment, then press the barbell back up to the starting position. Emphasize mini control. | Step:6 Repeat for the desired number of repetitions.",0.0,8.5,7.5,0.0,8.0,6.0,0.0,0.0,0.0,9.0,Strength Training,3.8,3.9,7.0,7.0,3.8,6.0,7.0,7.0,6.0,5.0,4.5
o6LqKKP,Traditional Barbell Romanian Deadlift,4,barbell,glutes,"hamstrings, lower back",upper legs,3,https://static.exercisedb.dev/media/o6LqKKP.gif,"Step:1 Stand with your feet shoulder-width apart and your toes pointing forward. | Step:2 Hold the barbell with an overhand grip, hands slightly wider than shoulder-width apart. | Step:3 Bend at the hips, keeping your back straight and your knees slightly bent. | Step:4 Lower the barbell towards the ground, keeping it close to your body. | Step:5 Feel the stretch in your hamstrings as you lower the barbell. | Step:6 Once you feel a stretch in your hamstrings, push your hips forward and stand up straight. | Step:7 Squeeze your glutes at the top of the movement. | Step:8 Lower the barbell back down to the starting position and repeat for the desired number of repetitions. Focus on traditional movement.",0.0,8.5,7.5,0.0,8.0,6.0,0.0,0.0,0.0,9.0,Strength Training,3.8,3.9,7.0,7.0,3.8,3.0,6.0,6.0,8.0,7.0,4.5
Mr8d4KA,Kettlebell Arnold Press - Beginner Variation,2,kettlebell,delts,"triceps, upper back",shoulders,3,https://static.exercisedb.dev/media/Mr8d4KA.gif,"Step:1 Stand with your feet shoulder-width apart, holding a kettlebell in each hand at shoulder height with your palms facing towards you. | Step:2 Engage your core and press the kettlebells overhead, rotating your palms to face forward as you extend your arms. Emphasize beginner control. | Step:3 Pause at the top of the movement, then slowly lower the kettlebells back to the starting position. | Step:4 Repeat for the desired number of repetitions.",0.0,8.5,7.5,0.0,8.0,6.0,0.0,0.0,0.0,9.0,Strength Training,3.8,3.9,7.0,7.0,3.8,8.5,8.0,6.0,5.0,3.0,4.5
Gu2ENkm,Deep Smith Machine Reverse Decline Close Grip Bench Press,3,smith machine,pectorals,"triceps, shoulders",chest,3,https://static.exercisedb.dev/media/Gu2ENkm.gif,"Step:1 Adjust the smith machine to a decline position. | Step:2 Lie down on the bench with your feet secured under the foot pads. | Step:3 Grasp the barbell with a close grip, slightly narrower than shoulder-width apart. | Step:4 Unrack the barbell and lower it slowly towards your chest, keeping your elbows tucked in. Focus on deep movement. | Step:5 Pause for a moment at the bottom, then push the barbell back up to the starting position. | Step:6 Repeat for the desired number of repetitions.",0.0,8.5,7.5,0.0,8.0,6.0,0.0,0.0,0.0,9.0,Strength Training,3.8,3.9,7.0,7.0,3.8,5.0,7.0,7.0,7.0,6.0,4.5
afv0ZAS,Upright Smith Incline Bench Press,3,smith machine,pectorals,"shoulders, triceps",chest,3,https://static.exercisedb.dev/media/afv0ZAS.gif,"Step:1 Adjust the bench to a 30-45 degree incline. | Step:2 Sit on the bench with your back flat against the pad and feet firmly on the ground. | Step:3 Grasp the barbell with an overhand grip slightly wider than shoulder-width apart. Perform with upright intensity. | Step:4 Unrack the barbell and lower it slowly towards your upper chest, keeping your elbows slightly tucked in. | Step:5 Pause for a moment at the bottom, then push the barbell back up to the starting position, fully extending your arms. | Step:6 Repeat for the desired number of repetitions.",0.0,8.5,7.5,0.0,8.0,6.0,0.0,0.0,0.0,9.0,Strength Training,3.8,3.9,7.0,7.0,3.8,5.0,7.0,7.0,7.0,6.0,4.5
r4RZKpF,Dumbbell One Arm Fly On Exercise Ball Improved,3,dumbbell,pectorals,"shoulders, triceps",chest,3,https://static.exercisedb.dev/media/r4RZKpF.gif,"Step:1 Sit on an exercise ball with a dumbbell in one hand and your feet flat on the ground. | Step:2 Walk your feet forward and roll your body down until your upper back is resting on the exercise ball. | Step:3 Extend your arm with the dumbbell straight up above your chest, palm facing inwards. | Step:4 Slowly lower the dumbbell out to the side, keeping a slight bend in your elbow. | Step:5 Pause for a moment, then squeeze your chest muscles to bring the dumbbell back to the starting position. | Step:6 Repeat for the desired number of repetitions, then switch arms. Focus on improved movement.",0.0,8.5,7.5,0.0,8.0,6.0,0.0,0.0,0.0,9.0,Strength Training,3.8,3.9,7.0,7.0,3.8,7.5,7.0,7.0,6.0,5.0,4.5
lRcrlH8,Fast Band Straight Leg Deadlift,3,band,spine,"hamstrings, glutes",back,3,https://static.exercisedb.dev/media/lRcrlH8.gif,"Step:1 Stand with your feet shoulder-width apart and place the band around your feet. | Step:2 Hold the band with both hands, palms facing your body, and keep your arms straight. | Step:3 Engage your core and maintain a slight bend in your knees. | Step:4 Slowly hinge forward at your hips, keeping your back straight and chest lifted. | Step:5 Lower the band towards the ground while keeping your legs straight. | Step:6 Pause for a moment at the bottom, then squeeze your glutes and hamstrings to return to the starting position. | Step:7 Repeat for the desired number of repetitions. Perform with fast intensity.",0.0,8.5,7.5,0.0,8.0,6.0,0.0,0.0,0.0,9.0,Strength Training,3.8,3.9,7.0,7.0,3.8,7.5,7.0,7.0,6.0,5.0,4.5
nFHk9fU,Cable Lateral Pulldown (With Rope Attachment) Core,4,cable,lats,"biceps, forearms",back,3,https://static.exercisedb.dev/media/nFHk9fU.gif,"Step:1 Attach a rope attachment to the cable machine at a high position. | Step:2 Stand facing the machine with your feet shoulder-width apart. | Step:3 Grasp the rope with an overhand grip, palms facing each other. | Step:4 Keep your back straight and lean slightly back. | Step:5 Pull the rope down towards your sides, squeezing your shoulder blades together. Emphasize core control. | Step:6 Pause for a moment at the bottom of the movement. | Step:7 Slowly release the tension and allow the rope to return to the starting position. | Step:8 Repeat for the desired number of repetitions.",0.0,8.5,7.5,0.0,8.0,6.0,0.0,0.0,0.0,9.0,Strength Training,3.8,3.9,7.0,7.0,3.8,3.0,6.0,6.0,8.0,7.0,4.5
Xd65M9w,Dumbbell Around Pullover - Intensive Variation,2,dumbbell,pectorals,"triceps, latissimus dorsi",chest,3,https://static.exercisedb.dev/media/Xd65M9w.gif,"Step:1 Lie flat on a bench with your head at one end and your feet firmly on the ground. | Step:2 Hold a dumbbell with both hands and extend your arms straight above your chest. Perform with intensive intensity. | Step:3 Keeping your arms straight, slowly lower the dumbbell behind your head in an arc motion. | Step:4 Pause for a moment at the bottom, then raise the dumbbell back to the starting position. | Step:5 Repeat for the desired number of repetitions.",0.0,8.5,7.5,0.0,8.0,6.0,0.0,0.0,0.0,9.0,Strength Training,3.8,3.9,7.0,7.0,3.8,8.5,8.0,6.0,5.0,3.0,4.5
