exercise_id,name,complexity_level,primary_equipment,target_muscles,secondary_muscles,body_parts,total_muscle_groups,gif_url,instructions,cardiovascular_endurance_score,muscular_strength_score,muscular_hypertrophy_score,power_development_score,functional_movement_score,calorie_expenditure_score,flexibility_mobility_score,balance_coordination_score,metabolic_conditioning_score,progressive_overload_score,primary_training_category,maintain_weight_compatibility,lose_weight_compatibility,gain_weight_compatibility,build_muscle_compatibility,improve_fitness_compatibility,sedentary_suitability,lightly_active_suitability,moderately_active_suitability,very_active_suitability,extremely_active_suitability,overall_quality_score
5v7KYld,Smith Incline Bench Press,3,smith machine,pectorals,"shoulders, triceps",chest,3,https://static.exercisedb.dev/media/5v7KYld.gif,"Step:1 Adjust the bench to a 30-45 degree incline. | Step:2 Sit on the bench with your back flat against the pad and feet firmly on the ground. | Step:3 Grasp the barbell with an overhand grip slightly wider than shoulder-width apart. | Step:4 Unrack the barbell and lower it slowly towards your upper chest, keeping your elbows slightly tucked in. | Step:5 Pause for a moment at the bottom, then push the barbell back up to the starting position, fully extending your arms. | Step:6 Repeat for the desired number of repetitions.",0.0,8.5,7.5,0.0,8.0,6.0,0.0,0.0,0.0,9.0,Strength Training,3.8,3.9,7.0,7.0,3.8,5.0,7.0,7.0,7.0,6.0,4.5
FS63wTN,Dumbbell Push Press,2,dumbbell,delts,"triceps, core",shoulders,3,https://static.exercisedb.dev/media/FS63wTN.gif,"Step:1 Stand with your feet shoulder-width apart, holding a dumbbell in each hand at shoulder level. | Step:2 Bend your knees slightly and dip your body down, then explosively extend your legs and press the dumbbells overhead. | Step:3 Lock out your arms at the top of the movement, then lower the dumbbells back to shoulder level. | Step:4 Repeat for the desired number of repetitions.",0.0,8.5,7.5,0.0,8.0,6.0,0.0,0.0,0.0,9.0,Strength Training,3.8,3.9,7.0,7.0,3.8,8.5,8.0,6.0,5.0,3.0,4.5
rg59QCH,Kettlebell One Arm Floor Press,2,kettlebell,pectorals,"triceps, shoulders",chest,3,https://static.exercisedb.dev/media/rg59QCH.gif,"Step:1 Lie flat on your back on the floor with your knees bent and feet flat on the ground. | Step:2 Hold the kettlebell in one hand with your palm facing towards your feet and your arm extended straight up towards the ceiling. | Step:3 Slowly lower the kettlebell towards your chest by bending your elbow, keeping your upper arm close to your body. | Step:4 Pause for a moment when the kettlebell is just above your chest, then push it back up to the starting position by extending your elbow. | Step:5 Repeat for the desired number of repetitions, then switch to the other arm.",0.0,8.5,7.5,0.0,8.0,6.0,0.0,0.0,0.0,9.0,Strength Training,3.8,3.9,7.0,7.0,3.8,8.5,8.0,6.0,5.0,3.0,4.5
nIR4Rwl,Cable Seated Chest Press,3,cable,pectorals,"shoulders, triceps",chest,3,https://static.exercisedb.dev/media/nIR4Rwl.gif,"Step:1 Adjust the seat height and cable handles to a comfortable position. | Step:2 Sit on the bench with your back straight and feet flat on the floor. | Step:3 Grasp the cable handles with an overhand grip at shoulder height. | Step:4 Push the handles forward and away from your body, extending your arms fully. | Step:5 Pause for a moment, then slowly bring the handles back to the starting position. | Step:6 Repeat for the desired number of repetitions.",0.0,8.5,7.5,0.0,8.0,6.0,0.0,0.0,0.0,9.0,Strength Training,3.8,3.9,7.0,7.0,3.8,5.0,7.0,7.0,7.0,6.0,4.5
s7HX1BY,Barbell Wide Squat,3,barbell,quads,"glutes, hamstrings, calves",upper legs,4,https://static.exercisedb.dev/media/s7HX1BY.gif,"Step:1 Stand with your feet wider than shoulder-width apart, toes pointing slightly outward. | Step:2 Hold the barbell across your upper back, resting it on your traps or rear delts. | Step:3 Engage your core and keep your chest up as you lower your body down into a squat, pushing your hips back and bending your knees. | Step:4 Lower until your thighs are parallel to the ground, or as low as you can comfortably go. | Step:5 Pause for a moment at the bottom, then push through your heels to return to the starting position. | Step:6 Repeat for the desired number of repetitions.",0.0,8.5,7.5,0.0,8.0,6.0,0.0,0.0,0.0,9.0,Strength Training,3.8,3.9,7.0,7.0,3.8,5.0,7.0,7.0,7.0,6.0,4.5
SNFfUff,Barbell Lying Lifting (On Hip),2,barbell,glutes,"hamstrings, quadriceps",upper legs,3,https://static.exercisedb.dev/media/SNFfUff.gif,"Step:1 Lie flat on your back on a bench with your feet flat on the ground and your knees bent. | Step:2 Hold the barbell with an overhand grip and position it on your hips. | Step:3 Engaging your glutes, lift your hips off the bench until your body forms a straight line from your knees to your shoulders. | Step:4 Pause for a moment at the top, then slowly lower your hips back down to the starting position. | Step:5 Repeat for the desired number of repetitions.",0.0,8.5,7.5,0.0,8.0,6.0,0.0,0.0,0.0,9.0,Strength Training,3.8,3.9,7.0,7.0,3.8,6.0,8.0,6.0,6.0,4.0,4.5
cA9FuWG,Barbell Bent Arm Pullover,2,barbell,lats,"triceps, chest",back,3,https://static.exercisedb.dev/media/cA9FuWG.gif,"Step:1 Lie flat on a bench with your head at one end and your feet on the floor. | Step:2 Hold a barbell with a shoulder-width grip and extend your arms straight above your chest. | Step:3 Lower the barbell behind your head while keeping your arms slightly bent. | Step:4 Pause for a moment, then raise the barbell back to the starting position. | Step:5 Repeat for the desired number of repetitions.",0.0,8.5,7.5,0.0,8.0,6.0,0.0,0.0,0.0,9.0,Strength Training,3.8,3.9,7.0,7.0,3.8,6.0,8.0,6.0,6.0,4.0,4.5
nDK1HJ0,Ez Bar Lying Bent Arms Pullover,3,ez barbell,lats,"triceps, chest",back,3,https://static.exercisedb.dev/media/nDK1HJ0.gif,"Step:1 Lie flat on a bench with your head at one end and your feet on the floor. | Step:2 Hold the EZ barbell with a pronated grip (palms facing away from you) and your hands shoulder-width apart. | Step:3 Extend your arms straight above your chest, keeping a slight bend in your elbows. | Step:4 Lower the barbell in an arc motion behind your head, maintaining the slight bend in your elbows. | Step:5 Pause for a moment, then return the barbell to the starting position by reversing the arc motion. | Step:6 Repeat for the desired number of repetitions.",0.0,8.5,7.5,0.0,8.0,6.0,0.0,0.0,0.0,9.0,Strength Training,3.8,3.9,7.0,7.0,3.8,6.0,7.0,7.0,6.0,5.0,4.5
Xy4jlWA,Dumbbell Arnold Press,2,dumbbell,delts,"triceps, upper chest",shoulders,3,https://static.exercisedb.dev/media/Xy4jlWA.gif,"Step:1 Sit on a bench with back support and hold a dumbbell in each hand at shoulder level, palms facing your body and elbows bent. | Step:2 Press the dumbbells upward until your arms are fully extended and your palms are facing forward. | Step:3 Rotate your wrists as you lift, so that your palms are facing forward at the top of the movement. | Step:4 Pause for a moment at the top, then slowly lower the dumbbells back to the starting position. | Step:5 Repeat for the desired number of repetitions.",0.0,8.5,7.5,0.0,8.0,6.0,0.0,0.0,0.0,9.0,Strength Training,3.8,3.9,7.0,7.0,3.8,8.5,8.0,6.0,5.0,3.0,4.5
qXTaZnJ,Barbell Full Squat,4,barbell,glutes,"quadriceps, hamstrings, calves, core",upper legs,5,https://static.exercisedb.dev/media/qXTaZnJ.gif,"Step:1 Stand with your feet shoulder-width apart, toes slightly turned out. | Step:2 Hold the barbell across your upper back, resting it on your traps or rear delts. | Step:3 Engage your core and keep your chest up as you begin to lower your body down. | Step:4 Bend at the knees and hips, pushing your hips back and down as if sitting into a chair. | Step:5 Lower yourself until your thighs are parallel to the ground or slightly below. | Step:6 Keep your knees in line with your toes and your weight in your heels. | Step:7 Drive through your heels to stand back up, extending your hips and knees. | Step:8 Repeat for the desired number of repetitions.",0.0,8.5,7.5,0.0,8.0,6.0,0.0,0.0,0.0,9.0,Strength Training,3.8,3.9,7.0,7.0,3.8,3.0,6.0,6.0,8.0,7.0,4.5
0lQnxMZ,Weighted Sissy Squat,3,weighted,quads,"glutes, hamstrings, calves",upper legs,4,https://static.exercisedb.dev/media/0lQnxMZ.gif,"Step:1 Stand with your feet shoulder-width apart and your toes pointing slightly outward. | Step:2 Hold a weight in front of your chest with both hands, or place a barbell across your upper back. | Step:3 Keeping your chest up and your core engaged, slowly lower your body down by bending at the knees and hips. | Step:4 Continue lowering until your thighs are parallel to the ground or as low as you can comfortably go. | Step:5 Pause for a moment at the bottom, then push through your heels to return to the starting position. | Step:6 Repeat for the desired number of repetitions.",0.0,8.5,7.5,0.0,8.0,6.0,0.0,0.0,0.0,9.0,Strength Training,3.8,3.9,7.0,7.0,3.8,6.0,7.0,7.0,6.0,5.0,4.5
HUEqZ1y,Barbell Side Split Squat V. 2,3,barbell,quads,"glutes, hamstrings, calves",upper legs,4,https://static.exercisedb.dev/media/HUEqZ1y.gif,"Step:1 Stand with your feet wider than shoulder-width apart, toes pointing slightly outwards. | Step:2 Hold a barbell across your upper back, resting it on your shoulders. | Step:3 Take a big step to the side with your right foot, keeping your left foot planted. | Step:4 Bend your right knee and lower your body down into a squat position, keeping your chest up and your back straight. | Step:5 Push through your right heel to return to the starting position. | Step:6 Repeat on the other side, stepping out with your left foot. | Step:7 Continue alternating sides for the desired number of repetitions.",0.0,8.5,7.5,0.0,8.0,6.0,0.0,0.0,0.0,9.0,Strength Training,3.8,3.9,7.0,7.0,3.8,5.0,7.0,7.0,7.0,6.0,4.5
bfiHMpI,Dumbbell Incline Press On Exercise Ball,3,dumbbell,pectorals,"shoulders, triceps",chest,3,https://static.exercisedb.dev/media/bfiHMpI.gif,"Step:1 Sit on an exercise ball with a dumbbell in each hand, palms facing forward. | Step:2 Slowly walk your feet forward, rolling your body down the ball until your head, neck, and upper back are supported on the ball. | Step:3 Hold the dumbbells at shoulder level, elbows bent and pointing out to the sides. | Step:4 Press the dumbbells upward, extending your arms fully. | Step:5 Pause for a moment at the top, then slowly lower the dumbbells back to the starting position. | Step:6 Repeat for the desired number of repetitions.",0.0,8.5,7.5,0.0,8.0,6.0,0.0,0.0,0.0,9.0,Strength Training,3.8,3.9,7.0,7.0,3.8,7.5,7.0,7.0,6.0,5.0,4.5
0dCyly0,Barbell Seated Bradford Rocky Press,2,barbell,delts,"triceps, upper back",shoulders,3,https://static.exercisedb.dev/media/0dCyly0.gif,"Step:1 Sit on a bench with your back straight and feet flat on the ground. | Step:2 Hold the barbell with an overhand grip, slightly wider than shoulder-width apart. | Step:3 Lift the barbell to shoulder height, keeping your elbows slightly bent and pointing forward. | Step:4 Press the barbell overhead, fully extending your arms. | Step:5 Lower the barbell back to shoulder height and repeat for the desired number of repetitions.",0.0,8.5,7.5,0.0,8.0,6.0,0.0,0.0,0.0,9.0,Strength Training,3.8,3.9,7.0,7.0,3.8,6.0,8.0,6.0,6.0,4.0,4.5
2Qh2J1e,Sled 45 Leg Press (Side Pov),3,sled machine,glutes,"quadriceps, hamstrings, calves",upper legs,4,https://static.exercisedb.dev/media/2Qh2J1e.gif,"Step:1 Adjust the seat of the sled machine so that your knees are at a 90-degree angle when your feet are on the footplate. | Step:2 Sit on the sled machine with your back flat against the backrest and your feet shoulder-width apart on the footplate. | Step:3 Grip the handles on the sides of the seat for stability. | Step:4 Push against the footplate to extend your legs, straightening them completely. | Step:5 Pause for a moment at the top, then slowly bend your knees to lower the footplate back to the starting position. | Step:6 Repeat for the desired number of repetitions.",0.0,8.5,7.5,0.0,8.0,6.0,0.0,0.0,0.0,9.0,Strength Training,3.8,3.9,7.0,7.0,3.8,6.0,7.0,7.0,6.0,5.0,4.5
4U7iLb5,Lever Pullover,3,leverage machine,lats,"triceps, shoulders",back,3,https://static.exercisedb.dev/media/4U7iLb5.gif,"Step:1 Adjust the seat and handles of the leverage machine to a comfortable position. | Step:2 Sit on the machine with your back against the pad and grasp the handles with an overhand grip. | Step:3 Keep your arms slightly bent and your core engaged. | Step:4 Slowly pull the handles towards your chest, squeezing your lats. | Step:5 Pause for a moment at the peak contraction, then slowly return to the starting position. | Step:6 Repeat for the desired number of repetitions.",0.0,8.5,7.5,0.0,8.0,6.0,0.0,0.0,0.0,9.0,Strength Training,3.8,3.9,7.0,7.0,3.8,6.0,7.0,7.0,6.0,5.0,4.5
M2Pm3zj,Dumbbell Lying Supination,2,dumbbell,forearms,"biceps, shoulders",lower arms,3,https://static.exercisedb.dev/media/M2Pm3zj.gif,"Step:1 Lie flat on a bench with your feet flat on the ground. | Step:2 Hold a dumbbell in each hand with your palms facing up and your arms fully extended. | Step:3 Keeping your upper arms stationary, curl the dumbbells towards your shoulders by contracting your forearms. | Step:4 Pause for a moment at the top, then slowly lower the dumbbells back to the starting position. | Step:5 Repeat for the desired number of repetitions.",0.0,8.5,7.5,0.0,8.0,6.0,0.0,0.0,0.0,9.0,Strength Training,3.8,3.9,7.0,7.0,3.8,8.5,8.0,6.0,5.0,3.0,4.5
ETZfAbZ,Smith Decline Bench Press,3,smith machine,pectorals,"triceps, shoulders",chest,3,https://static.exercisedb.dev/media/ETZfAbZ.gif,"Step:1 Adjust the decline bench to the desired angle. | Step:2 Lie down on the bench with your feet secured under the foot pads. | Step:3 Grasp the barbell with an overhand grip slightly wider than shoulder-width apart. | Step:4 Unrack the barbell and lower it slowly towards your chest, keeping your elbows tucked in. | Step:5 Pause for a moment at the bottom, then push the barbell back up to the starting position. | Step:6 Repeat for the desired number of repetitions.",0.0,8.5,7.5,0.0,8.0,6.0,0.0,0.0,0.0,9.0,Strength Training,3.8,3.9,7.0,7.0,3.8,5.0,7.0,7.0,7.0,6.0,4.5
q7qkONO,Dumbbell Seated Alternate Shoulder,2,dumbbell,delts,"triceps, upper back",shoulders,3,https://static.exercisedb.dev/media/q7qkONO.gif,"Step:1 Sit on a bench with your back straight and feet flat on the ground. | Step:2 Hold a dumbbell in each hand, palms facing inwards, and raise them to shoulder height. | Step:3 Press one dumbbell up overhead while keeping the other dumbbell at shoulder height. | Step:4 Lower the raised dumbbell back to shoulder height while simultaneously pressing the other dumbbell up overhead. | Step:5 Continue alternating between arms for the desired number of repetitions.",0.0,8.5,7.5,0.0,8.0,6.0,0.0,0.0,0.0,9.0,Strength Training,3.8,3.9,7.0,7.0,3.8,8.5,8.0,6.0,5.0,3.0,4.5
zK8Fu1W,Smith Reverse-Grip Press,4,smith machine,pectorals,"triceps, shoulders",chest,3,https://static.exercisedb.dev/media/zK8Fu1W.gif,"Step:1 Adjust the height of the smith machine bar to chest level. | Step:2 Stand facing the bar with your feet shoulder-width apart. | Step:3 Grasp the bar with an overhand grip, hands slightly wider than shoulder-width apart. | Step:4 Step back and position yourself with a slight bend in your knees. | Step:5 Keep your chest up and core engaged throughout the exercise. | Step:6 Lower the bar towards your chest, keeping your elbows tucked in. | Step:7 Pause for a moment at the bottom, then push the bar back up to the starting position. | Step:8 Repeat for the desired number of repetitions.",0.0,8.5,7.5,0.0,8.0,6.0,0.0,0.0,0.0,9.0,Strength Training,3.8,3.9,7.0,7.0,3.8,3.0,6.0,6.0,8.0,7.0,4.5
8ARQ9Hw,Kettlebell Sumo High Pull,3,kettlebell,traps,"shoulders, glutes, hamstrings",back,4,https://static.exercisedb.dev/media/8ARQ9Hw.gif,"Step:1 Stand with your feet wider than shoulder-width apart, toes pointing outwards. | Step:2 Hold a kettlebell with both hands in front of your body, arms extended downwards. | Step:3 Bend your knees and lower your hips into a squat position, keeping your back straight. | Step:4 Drive through your heels and explosively extend your hips and knees, pulling the kettlebell up towards your chin. | Step:5 As you pull the kettlebell up, keep your elbows high and wide, and squeeze your shoulder blades together. | Step:6 Lower the kettlebell back down to the starting position and repeat for the desired number of repetitions.",0.0,8.5,7.5,0.0,8.0,6.0,0.0,0.0,0.0,9.0,Strength Training,3.8,3.9,7.0,7.0,3.8,7.5,7.0,7.0,6.0,5.0,4.5
pP8wP2P,Dumbbell Neutral Grip Bench Press,2,dumbbell,triceps,"chest, shoulders",upper arms,3,https://static.exercisedb.dev/media/pP8wP2P.gif,"Step:1 Lie flat on a bench with your feet flat on the ground and your back pressed against the bench. | Step:2 Hold a dumbbell in each hand with a neutral grip (palms facing each other) and your arms extended straight up over your chest. | Step:3 Slowly lower the dumbbells down towards your chest, keeping your elbows close to your body. | Step:4 Pause for a moment at the bottom, then push the dumbbells back up to the starting position, fully extending your arms. | Step:5 Repeat for the desired number of repetitions.",0.0,8.5,7.5,0.0,8.0,6.0,0.0,0.0,0.0,9.0,Strength Training,3.8,3.9,7.0,7.0,3.8,8.5,8.0,6.0,5.0,3.0,4.5
7xI5MXA,Cable Bench Press,4,cable,pectorals,"triceps, shoulders",chest,3,https://static.exercisedb.dev/media/7xI5MXA.gif,"Step:1 Adjust the cable machine to chest height and attach the handles. | Step:2 Stand facing away from the machine with your feet shoulder-width apart. | Step:3 Grasp the handles with an overhand grip and step forward to create tension in the cables. | Step:4 Position your feet firmly on the ground and engage your core. | Step:5 Bend your elbows and bring your hands to shoulder level, keeping your elbows at a 90-degree angle. | Step:6 Push the handles forward, extending your arms fully in front of you. | Step:7 Pause for a moment, then slowly reverse the movement, bringing your hands back to shoulder level. | Step:8 Repeat for the desired number of repetitions.",0.0,8.5,7.5,0.0,8.0,6.0,0.0,0.0,0.0,9.0,Strength Training,3.8,3.9,7.0,7.0,3.8,3.0,6.0,6.0,8.0,7.0,4.5
X6ytgYZ,Dumbbell Side Plank With Rear Fly,3,dumbbell,upper back,"shoulders, core",back,3,https://static.exercisedb.dev/media/X6ytgYZ.gif,"Step:1 Start by lying on your side with your legs extended and stacked on top of each other. | Step:2 Place your forearm on the ground directly below your shoulder, keeping your elbow bent at a 90-degree angle. | Step:3 Hold a dumbbell in your top hand, with your arm extended straight down towards the ground. | Step:4 Engage your core and lift your hips off the ground, creating a straight line from your head to your heels. | Step:5 While maintaining the side plank position, lift the dumbbell up towards the ceiling, squeezing your shoulder blades together. | Step:6 Lower the dumbbell back down to the starting position. | Step:7 Repeat for the desired number of repetitions, then switch sides.",0.0,8.5,7.5,0.0,8.0,6.0,0.0,0.0,0.0,9.0,Strength Training,3.8,3.9,7.0,7.0,3.8,7.5,7.0,7.0,6.0,5.0,4.5
Bg5JKSH,Dumbbell Incline One Arm Press On Exercise Ball,3,dumbbell,pectorals,"shoulders, triceps",chest,3,https://static.exercisedb.dev/media/Bg5JKSH.gif,"Step:1 Sit on an exercise ball with a dumbbell in one hand, feet flat on the ground. | Step:2 Slowly walk your feet forward, rolling the ball until your head, neck, and upper back are supported on the ball. | Step:3 Hold the dumbbell at shoulder height with your palm facing forward. | Step:4 Press the dumbbell upward until your arm is fully extended. | Step:5 Pause for a moment at the top, then slowly lower the dumbbell back to the starting position. | Step:6 Repeat for the desired number of repetitions, then switch to the other arm.",0.0,8.5,7.5,0.0,8.0,6.0,0.0,0.0,0.0,9.0,Strength Training,3.8,3.9,7.0,7.0,3.8,7.5,7.0,7.0,6.0,5.0,4.5
PG1kcIb,Dumbbell Incline Hammer Press,2,dumbbell,pectorals,"shoulders, triceps",chest,3,https://static.exercisedb.dev/media/PG1kcIb.gif,"Step:1 Set an incline bench to a 45-degree angle and sit on it with a dumbbell in each hand, resting on your thighs. | Step:2 Lie back on the bench and position the dumbbells at shoulder level with your palms facing each other. | Step:3 Press the dumbbells up and away from your body until your arms are fully extended. | Step:4 Pause for a moment at the top, then slowly lower the dumbbells back down to the starting position. | Step:5 Repeat for the desired number of repetitions.",0.0,8.5,7.5,0.0,8.0,6.0,0.0,0.0,0.0,9.0,Strength Training,3.8,3.9,7.0,7.0,3.8,8.5,8.0,6.0,5.0,3.0,4.5
yCvYdi7,Kettlebell One Arm Military Press To The Side,2,kettlebell,delts,"triceps, core",shoulders,3,https://static.exercisedb.dev/media/yCvYdi7.gif,"Step:1 Stand with your feet shoulder-width apart, holding a kettlebell in one hand at shoulder height. | Step:2 Engage your core and keep your back straight. | Step:3 Press the kettlebell overhead, extending your arm fully. | Step:4 Pause for a moment at the top, then slowly lower the kettlebell back to the starting position. | Step:5 Repeat for the desired number of repetitions, then switch sides.",0.0,8.5,7.5,0.0,8.0,6.0,0.0,0.0,0.0,9.0,Strength Training,3.8,3.9,7.0,7.0,3.8,8.5,8.0,6.0,5.0,3.0,4.5
53Ttlck,Dumbbell Lying Rear Lateral Raise,1,dumbbell,delts,"traps, rhomboids",shoulders,3,https://static.exercisedb.dev/media/53Ttlck.gif,"Step:1 Lie face down on a flat bench with a dumbbell in each hand, palms facing each other. | Step:2 Extend your arms straight down towards the floor, keeping a slight bend in your elbows. | Step:3 Engaging your shoulder muscles, lift your arms out to the sides until they are parallel to the floor. | Step:4 Pause for a moment at the top, then slowly lower your arms back down to the starting position. | Step:5 Repeat for the desired number of repetitions.",0.0,8.5,7.5,0.0,8.0,6.0,0.0,0.0,0.0,9.0,Strength Training,3.8,3.9,7.0,7.0,3.8,9.5,7.0,5.0,3.0,3.0,4.5
jFtipLl,Smith Squat,4,smith machine,glutes,"quadriceps, hamstrings, calves",upper legs,4,https://static.exercisedb.dev/media/jFtipLl.gif,"Step:1 Set up the smith machine with the barbell at an appropriate height for your squat. | Step:2 Stand with your feet shoulder-width apart, toes slightly turned out. | Step:3 Position yourself under the barbell, resting it on your upper traps and shoulders. | Step:4 Grip the barbell with a wide grip, slightly wider than shoulder-width apart. | Step:5 Engage your core and unrack the barbell, stepping back to clear the rack. | Step:6 Keeping your chest up and back straight, initiate the squat by bending at the hips and knees. | Step:7 Lower your body until your thighs are parallel to the ground or slightly below. | Step:8 Pause for a moment at the bottom, then drive through your heels to return to the starting position. | Step:9 Repeat for the desired number of repetitions.",0.0,8.5,7.5,0.0,8.0,6.0,0.0,0.0,0.0,9.0,Strength Training,3.8,3.9,7.0,7.0,3.8,3.0,6.0,6.0,8.0,7.0,4.5
6e2DcYX,Dumbbell Incline Shoulder Raise,2,dumbbell,serratus anterior,"deltoids, trapezius",chest,3,https://static.exercisedb.dev/media/6e2DcYX.gif,"Step:1 Set an incline bench to a 45-degree angle and sit on it with a dumbbell in each hand, palms facing down. | Step:2 Rest the dumbbells on your thighs and lean back onto the bench. | Step:3 Use your thighs to help raise the dumbbells to shoulder height, then rotate your wrists so that your palms are facing forward. | Step:4 Exhale and slowly raise the dumbbells above your head, keeping a slight bend in your elbows. | Step:5 Pause for a moment at the top, then inhale and slowly lower the dumbbells back to shoulder height. | Step:6 Repeat for the desired number of repetitions.",0.0,8.5,7.5,0.0,8.0,6.0,0.0,0.0,0.0,9.0,Strength Training,3.8,3.9,7.0,7.0,3.8,8.5,8.0,6.0,5.0,3.0,4.5
Lt3iWnf,Dumbbell Fly On Exercise Ball,3,dumbbell,pectorals,"shoulders, triceps",chest,3,https://static.exercisedb.dev/media/Lt3iWnf.gif,"Step:1 Sit on an exercise ball and hold a dumbbell in each hand. | Step:2 Walk your feet forward and roll your body down until your head, neck, and upper back are supported by the ball. | Step:3 Extend your arms straight up above your chest, palms facing each other. | Step:4 Bend your elbows slightly and lower your arms out to the sides in a wide arc until you feel a stretch in your chest. | Step:5 Pause for a moment, then reverse the movement and squeeze your chest muscles as you bring the dumbbells back to the starting position. | Step:6 Repeat for the desired number of repetitions.",0.0,8.5,7.5,0.0,8.0,6.0,0.0,0.0,0.0,9.0,Strength Training,3.8,3.9,7.0,7.0,3.8,7.5,7.0,7.0,6.0,5.0,4.5
JsKq9so,Barbell Wide Bench Press,3,barbell,pectorals,"shoulders, triceps",chest,3,https://static.exercisedb.dev/media/JsKq9so.gif,"Step:1 Lie flat on a bench with your feet flat on the ground and your back pressed against the bench. | Step:2 Grasp the barbell with a wide grip, slightly wider than shoulder-width apart. | Step:3 Lift the barbell off the rack and hold it directly above your chest with your arms fully extended. | Step:4 Lower the barbell slowly towards your chest, keeping your elbows slightly flared out. | Step:5 Pause for a moment when the barbell touches your chest, then push it back up to the starting position. | Step:6 Repeat for the desired number of repetitions.",0.0,8.5,7.5,0.0,8.0,6.0,0.0,0.0,0.0,9.0,Strength Training,3.8,3.9,7.0,7.0,3.8,5.0,7.0,7.0,7.0,6.0,4.5
