exercise_id,name,complexity_level,primary_equipment,target_muscles,secondary_muscles,body_parts,total_muscle_groups,gif_url,instructions,cardiovascular_endurance_score,muscular_strength_score,muscular_hypertrophy_score,power_development_score,functional_movement_score,calorie_expenditure_score,flexibility_mobility_score,balance_coordination_score,metabolic_conditioning_score,progressive_overload_score,primary_training_category,maintain_weight_compatibility,lose_weight_compatibility,gain_weight_compatibility,build_muscle_compatibility,improve_fitness_compatibility,sedentary_suitability,lightly_active_suitability,moderately_active_suitability,very_active_suitability,extremely_active_suitability,overall_quality_score
vtusOWT,Barbell One Arm Floor Press,2,barbell,triceps,"chest, shoulders",upper arms,3,https://static.exercisedb.dev/media/vtusOWT.gif,"Step:1 Lie flat on your back on the floor with your knees bent and feet flat on the ground. | Step:2 Hold the barbell with one hand, palm facing up, and extend your arm straight up over your chest. | Step:3 Slowly lower the barbell towards your chest, keeping your elbow close to your body. | Step:4 Pause for a moment at the bottom, then push the barbell back up to the starting position. | Step:5 Repeat for the desired number of repetitions, then switch arms.",0.0,8.5,7.5,0.0,8.0,6.0,0.0,0.0,0.0,9.0,Strength Training,3.8,3.9,7.0,7.0,3.8,6.0,8.0,6.0,6.0,4.0,4.5
yn2lLSI,Sled 45 Leg Press (Back Pov),3,sled machine,glutes,"quadriceps, hamstrings, calves",upper legs,4,https://static.exercisedb.dev/media/yn2lLSI.gif,"Step:1 Adjust the seat of the sled machine so that your knees are at a 45-degree angle. | Step:2 Sit on the sled machine with your back against the backrest and your feet shoulder-width apart on the footplate. | Step:3 Grip the handles on the sides of the seat for stability. | Step:4 Push the footplate away from your body by extending your legs, keeping your heels on the footplate. | Step:5 Pause for a moment at the fully extended position. | Step:6 Slowly bend your knees and lower the footplate back towards your body, controlling the movement. | Step:7 Repeat for the desired number of repetitions.",0.0,8.5,7.5,0.0,8.0,6.0,0.0,0.0,0.0,9.0,Strength Training,3.8,3.9,7.0,7.0,3.8,6.0,7.0,7.0,6.0,5.0,4.5
SpYC0Kp,Dumbbell Bench Press,2,dumbbell,pectorals,"triceps, shoulders",chest,3,https://static.exercisedb.dev/media/SpYC0Kp.gif,"Step:1 Lie flat on a bench with your feet flat on the ground and your back pressed against the bench. | Step:2 Hold a dumbbell in each hand, with your palms facing forward and your arms extended above your chest. | Step:3 Lower the dumbbells slowly to the sides of your chest, keeping your elbows at a 90-degree angle. | Step:4 Pause for a moment, then push the dumbbells back up to the starting position, fully extending your arms. | Step:5 Repeat for the desired number of repetitions.",0.0,8.5,7.5,0.0,8.0,6.0,0.0,0.0,0.0,9.0,Strength Training,3.8,3.9,7.0,7.0,3.8,8.5,8.0,6.0,5.0,3.0,4.5
K3dIO25,Dumbbell Lying One Arm Press V. 2,3,dumbbell,pectorals,"triceps, shoulders",chest,3,https://static.exercisedb.dev/media/K3dIO25.gif,"Step:1 Lie flat on a bench with your back supported and feet flat on the ground. | Step:2 Hold a dumbbell in one hand with your palm facing towards your feet. | Step:3 Extend your arm straight up towards the ceiling, keeping your elbow slightly bent. | Step:4 Slowly lower the dumbbell down towards your chest, keeping your elbow close to your body. | Step:5 Pause for a moment at the bottom, then push the dumbbell back up to the starting position. | Step:6 Repeat for the desired number of repetitions, then switch to the other arm.",0.0,8.5,7.5,0.0,8.0,6.0,0.0,0.0,0.0,9.0,Strength Training,3.8,3.9,7.0,7.0,3.8,7.5,7.0,7.0,6.0,5.0,4.5
KHGNa16,Cable Decline One Arm Press,3,cable,pectorals,"triceps, shoulders",chest,3,https://static.exercisedb.dev/media/KHGNa16.gif,"Step:1 Adjust the cable machine to a decline position. | Step:2 Stand facing away from the machine and grab the handle with one hand. | Step:3 Position yourself with your back against the decline bench and your arm extended straight in front of you. | Step:4 Bend your elbow and lower the handle towards your chest while keeping your upper arm stationary. | Step:5 Pause for a moment at the bottom, then push the handle back up to the starting position. | Step:6 Repeat for the desired number of repetitions, then switch arms.",0.0,8.5,7.5,0.0,8.0,6.0,0.0,0.0,0.0,9.0,Strength Training,3.8,3.9,7.0,7.0,3.8,5.0,7.0,7.0,7.0,6.0,4.5
o17Jfkt,Lever Incline Chest Press V. 2,3,leverage machine,pectorals,"triceps, shoulders",chest,3,https://static.exercisedb.dev/media/o17Jfkt.gif,"Step:1 Adjust the seat height and backrest angle on the leverage machine to a comfortable position. | Step:2 Sit on the machine with your back against the backrest and your feet flat on the floor. | Step:3 Grasp the handles with an overhand grip and position your hands slightly wider than shoulder-width apart. | Step:4 Push the handles forward and away from your body until your arms are fully extended, but without locking your elbows. | Step:5 Pause for a moment at the fully extended position, then slowly bend your elbows and lower the handles back towards your chest. | Step:6 Repeat for the desired number of repetitions.",0.0,8.5,7.5,0.0,8.0,6.0,0.0,0.0,0.0,9.0,Strength Training,3.8,3.9,7.0,7.0,3.8,6.0,7.0,7.0,6.0,5.0,4.5
cwsAI4G,Dumbbell Decline Shrug,2,dumbbell,traps,"shoulders, rhomboids",back,3,https://static.exercisedb.dev/media/cwsAI4G.gif,"Step:1 Set up a decline bench at a 45-degree angle. | Step:2 Lie face down on the bench with your chest and stomach resting against it. | Step:3 Hold a dumbbell in each hand with your arms fully extended towards the floor. | Step:4 Keeping your arms straight, raise your shoulders towards your ears as high as possible. | Step:5 Hold the contraction for a moment, then slowly lower the dumbbells back to the starting position. | Step:6 Repeat for the desired number of repetitions.",0.0,8.5,7.5,0.0,8.0,6.0,0.0,0.0,0.0,9.0,Strength Training,3.8,3.9,7.0,7.0,3.8,8.5,8.0,6.0,5.0,3.0,4.5
bBi35y3,Dumbbell Standing Alternate Overhead Press,2,dumbbell,delts,"triceps, core",shoulders,3,https://static.exercisedb.dev/media/bBi35y3.gif,"Step:1 Stand with your feet shoulder-width apart, holding a dumbbell in each hand at shoulder level with your palms facing forward. | Step:2 Press one dumbbell overhead, fully extending your arm. | Step:3 Lower the dumbbell back to shoulder level. | Step:4 Repeat with the other arm. | Step:5 Continue alternating arms for the desired number of repetitions.",0.0,8.5,7.5,0.0,8.0,6.0,0.0,0.0,0.0,9.0,Strength Training,3.8,3.9,7.0,7.0,3.8,8.5,8.0,6.0,5.0,3.0,4.5
I1OBLnn,Weighted Svend Press,2,weighted,pectorals,"shoulders, triceps",chest,3,https://static.exercisedb.dev/media/I1OBLnn.gif,"Step:1 Stand with your feet shoulder-width apart and hold a weight plate in front of your chest with both hands. | Step:2 Keep your elbows slightly bent and your palms facing each other. | Step:3 Press the weight plate straight out in front of you, fully extending your arms. | Step:4 Pause for a moment at the end of the movement, then slowly bring the weight plate back to the starting position. | Step:5 Repeat for the desired number of repetitions.",0.0,8.5,7.5,0.0,8.0,6.0,0.0,0.0,0.0,9.0,Strength Training,3.8,3.9,7.0,7.0,3.8,7.0,8.0,6.0,5.0,3.0,4.5
uKyN64F,Barbell One Leg Squat,2,barbell,quads,"glutes, hamstrings, calves",upper legs,4,https://static.exercisedb.dev/media/uKyN64F.gif,"Step:1 Stand with your feet shoulder-width apart and hold a barbell across your upper back. | Step:2 Lift one foot off the ground and extend it forward, keeping it parallel to the ground. | Step:3 Bend your standing leg and lower your body down as if sitting back into a chair, keeping your chest up and your back straight. | Step:4 Lower yourself until your thigh is parallel to the ground, then push through your heel to return to the starting position. | Step:5 Repeat for the desired number of repetitions, then switch legs and repeat.",0.0,8.5,7.5,0.0,8.0,6.0,0.0,0.0,0.0,9.0,Strength Training,3.8,3.9,7.0,7.0,3.8,6.0,8.0,6.0,6.0,4.0,4.5
YtaCTYl,Dumbbell One Arm Seated Neutral Wrist Curl,1,dumbbell,forearms,"biceps, brachialis",lower arms,3,https://static.exercisedb.dev/media/YtaCTYl.gif,"Step:1 Sit on a bench with your feet flat on the ground and hold a dumbbell in one hand, palm facing up. | Step:2 Rest your forearm on your thigh, allowing your wrist to hang off the edge. | Step:3 Keeping your forearm stationary, curl your wrist upward as far as possible. | Step:4 Pause for a moment at the top, then slowly lower your wrist back down to the starting position. | Step:5 Repeat for the desired number of repetitions, then switch to the other hand.",0.0,8.5,7.5,0.0,8.0,6.0,0.0,0.0,0.0,9.0,Strength Training,3.8,3.9,7.0,7.0,3.8,9.5,7.0,5.0,3.0,3.0,4.5
SSsBDwB,Dumbbell Rear Lunge,2,dumbbell,glutes,"quadriceps, hamstrings, calves",upper legs,4,https://static.exercisedb.dev/media/SSsBDwB.gif,"Step:1 Stand with your feet shoulder-width apart, holding a dumbbell in each hand. | Step:2 Take a step backward with your right foot, lowering your body into a lunge position. | Step:3 Bend your left knee and lower your body until your left thigh is parallel to the ground. | Step:4 Pause for a moment, then push through your left heel to return to the starting position. | Step:5 Repeat on the other side, stepping back with your left foot.",0.0,8.5,7.5,0.0,8.0,6.0,0.0,0.0,0.0,9.0,Strength Training,3.8,3.9,7.0,7.0,3.8,8.5,8.0,6.0,5.0,3.0,4.5
2qTvJAZ,Barbell Standing Back Wrist Curl,1,barbell,forearms,"biceps, shoulders",lower arms,3,https://static.exercisedb.dev/media/2qTvJAZ.gif,"Step:1 Stand up straight with your feet shoulder-width apart and hold a barbell with an overhand grip. | Step:2 Rest the barbell on the back of your hands with your palms facing down and your fingers pointing towards your body. | Step:3 Keeping your upper arms stationary, exhale and curl your wrists upwards as far as possible. | Step:4 Hold the contracted position for a brief pause, then inhale and slowly lower the barbell back to the starting position. | Step:5 Repeat for the desired number of repetitions.",0.0,8.5,7.5,0.0,8.0,6.0,0.0,0.0,0.0,9.0,Strength Training,3.8,3.9,7.0,7.0,3.8,7.0,7.0,5.0,4.0,4.0,4.5
FxhcxUW,Dumbbell Seated One Leg Calf Raise - Hammer Grip,2,dumbbell,calves,"hamstrings, glutes",lower legs,3,https://static.exercisedb.dev/media/FxhcxUW.gif,"Step:1 Sit on a bench or chair with your feet flat on the ground and a dumbbell resting on your thighs. | Step:2 Place one foot on a raised surface, such as a step or block, with your heel hanging off the edge. | Step:3 Hold the dumbbell with a hammer grip, meaning your palms are facing each other and your fingers are wrapped around the handle. | Step:4 Keeping your core engaged and your back straight, slowly raise your heel as high as possible by pushing through the ball of your foot. | Step:5 Pause for a moment at the top, then slowly lower your heel back down to the starting position. | Step:6 Repeat for the desired number of repetitions, then switch to the other leg.",0.0,8.5,7.5,0.0,8.0,6.0,0.0,0.0,0.0,9.0,Strength Training,3.8,3.9,7.0,7.0,3.8,8.5,8.0,6.0,5.0,3.0,4.5
u0pLNgz,Sled One Leg Calf Press On Leg Press,3,sled machine,calves,"hamstrings, glutes",lower legs,3,https://static.exercisedb.dev/media/u0pLNgz.gif,"Step:1 Adjust the seat of the leg press machine so that your knees are slightly bent when your feet are on the sled. | Step:2 Sit on the machine with your back against the backrest and your feet on the sled, shoulder-width apart. | Step:3 Place your toes and the balls of your feet on the sled, keeping your heels off. | Step:4 Push the sled forward by extending your ankles, keeping your knees slightly bent. | Step:5 Pause for a moment at the top, then slowly lower the sled back down by flexing your ankles. | Step:6 Repeat for the desired number of repetitions.",0.0,8.5,7.5,0.0,8.0,6.0,0.0,0.0,0.0,9.0,Strength Training,3.8,3.9,7.0,7.0,3.8,6.0,7.0,7.0,6.0,5.0,4.5
c9MnDRp,Dumbbell Raise,1,dumbbell,delts,"traps, rhomboids",shoulders,3,https://static.exercisedb.dev/media/c9MnDRp.gif,"Step:1 Stand with your feet shoulder-width apart and hold a dumbbell in each hand, palms facing your body. | Step:2 Keep your back straight and engage your core. | Step:3 Raise your arms out to the sides until they are parallel to the floor, keeping a slight bend in your elbows. | Step:4 Pause for a moment at the top, then slowly lower your arms back down to the starting position. | Step:5 Repeat for the desired number of repetitions.",0.0,8.5,7.5,0.0,8.0,6.0,0.0,0.0,0.0,9.0,Strength Training,3.8,3.9,7.0,7.0,3.8,9.5,7.0,5.0,3.0,3.0,4.5
lHeUULr,Band Straight Back Stiff Leg Deadlift,3,band,glutes,"hamstrings, lower back",upper legs,3,https://static.exercisedb.dev/media/lHeUULr.gif,"Step:1 Stand with your feet shoulder-width apart and place the band around your upper legs. | Step:2 Hold the band with both hands in front of your thighs, palms facing your body. | Step:3 Keeping your back straight and your knees slightly bent, hinge at the hips and lower the band towards the ground. | Step:4 Feel the stretch in your hamstrings as you lower the band. | Step:5 Engage your glutes and hamstrings to lift your body back up to the starting position. | Step:6 Repeat for the desired number of repetitions.",0.0,8.5,7.5,0.0,8.0,6.0,0.0,0.0,0.0,9.0,Strength Training,3.8,3.9,7.0,7.0,3.8,7.5,7.0,7.0,6.0,5.0,4.5
gH5fRsC,Dumbbell Seated Alternate Front Raise,2,dumbbell,delts,"trapezius, biceps",shoulders,3,https://static.exercisedb.dev/media/gH5fRsC.gif,"Step:1 Sit on a bench with your back straight and feet flat on the ground. | Step:2 Hold a dumbbell in each hand with your palms facing your body and arms extended down by your sides. | Step:3 Keeping your arms straight, raise one dumbbell in front of you until it is parallel to the ground. | Step:4 Pause for a moment at the top, then slowly lower the dumbbell back down to the starting position. | Step:5 Repeat with the other arm. | Step:6 Alternate between arms for the desired number of repetitions.",0.0,8.5,7.5,0.0,8.0,6.0,0.0,0.0,0.0,9.0,Strength Training,3.8,3.9,7.0,7.0,3.8,8.5,8.0,6.0,5.0,3.0,4.5
7w6i0vE,Kettlebell Alternating Press On Floor,2,kettlebell,pectorals,"shoulders, triceps",chest,3,https://static.exercisedb.dev/media/7w6i0vE.gif,"Step:1 Start by lying on your back on the floor with your knees bent and feet flat on the ground. | Step:2 Hold a kettlebell in each hand, with your palms facing towards your feet and your arms extended straight up towards the ceiling. | Step:3 Lower one kettlebell down towards your shoulder while keeping the other kettlebell extended straight up. | Step:4 Press the lowered kettlebell back up to the starting position while simultaneously lowering the other kettlebell down towards your shoulder. | Step:5 Continue alternating the press motion with each kettlebell for the desired number of repetitions.",0.0,8.5,7.5,0.0,8.0,6.0,0.0,0.0,0.0,9.0,Strength Training,3.8,3.9,7.0,7.0,3.8,8.5,8.0,6.0,5.0,3.0,4.5
2Pya1cP,Cable Decline Press,4,cable,pectorals,"triceps, shoulders",chest,3,https://static.exercisedb.dev/media/2Pya1cP.gif,"Step:1 Adjust the cable machine to a decline position. | Step:2 Sit on the decline bench facing the cable machine. | Step:3 Grasp the handles with an overhand grip and position them at chest level. | Step:4 Keep your feet flat on the ground and your back firmly against the bench. | Step:5 Exhale and push the handles away from your body, extending your arms fully. | Step:6 Pause for a moment at the end of the movement, squeezing your chest muscles. | Step:7 Inhale and slowly return the handles back to the starting position. | Step:8 Repeat for the desired number of repetitions.",0.0,8.5,7.5,0.0,8.0,6.0,0.0,0.0,0.0,9.0,Strength Training,3.8,3.9,7.0,7.0,3.8,3.0,6.0,6.0,8.0,7.0,4.5
n5cWCsI,Dumbbell One Arm Lateral Raise,2,dumbbell,delts,"trapezius, triceps",shoulders,3,https://static.exercisedb.dev/media/n5cWCsI.gif,"Step:1 Stand with your feet shoulder-width apart, holding a dumbbell in one hand with your palm facing your body. | Step:2 Keep your back straight and your core engaged throughout the exercise. | Step:3 Raise the dumbbell to the side, keeping your arm straight and your palm facing down. | Step:4 Continue lifting until your arm is parallel to the ground. | Step:5 Pause for a moment at the top, then slowly lower the dumbbell back to the starting position. | Step:6 Repeat for the desired number of repetitions, then switch to the other arm.",0.0,8.5,7.5,0.0,8.0,6.0,0.0,0.0,0.0,9.0,Strength Training,3.8,3.9,7.0,7.0,3.8,8.5,8.0,6.0,5.0,3.0,4.5
QfAKy1G,Dumbbell Cuban Press,2,dumbbell,delts,"triceps, upper back",shoulders,3,https://static.exercisedb.dev/media/QfAKy1G.gif,"Step:1 Stand with your feet shoulder-width apart, holding a dumbbell in each hand at shoulder height with your palms facing down. | Step:2 Keeping your core engaged and your elbows slightly bent, press the dumbbells up and overhead until your arms are fully extended. | Step:3 Rotate your wrists so that your palms are facing forward. | Step:4 Slowly lower the dumbbells back to the starting position, rotating your wrists back to the starting position as you do so. | Step:5 Repeat for the desired number of repetitions.",0.0,8.5,7.5,0.0,8.0,6.0,0.0,0.0,0.0,9.0,Strength Training,3.8,3.9,7.0,7.0,3.8,8.5,8.0,6.0,5.0,3.0,4.5
B3Rxp6L,Dumbbell Incline Breeding,3,dumbbell,pectorals,"shoulders, triceps",chest,3,https://static.exercisedb.dev/media/B3Rxp6L.gif,"Step:1 Set up an incline bench at a 45-degree angle. | Step:2 Sit on the bench with your back against the pad and feet flat on the ground. | Step:3 Hold a dumbbell in each hand with an overhand grip, palms facing forward. | Step:4 Start with your arms fully extended, perpendicular to the ground. | Step:5 Lower the dumbbells slowly to the sides of your chest, keeping your elbows at a 90-degree angle. | Step:6 Pause for a moment at the bottom, then push the dumbbells back up to the starting position. | Step:7 Repeat for the desired number of repetitions.",0.0,8.5,7.5,0.0,8.0,6.0,0.0,0.0,0.0,9.0,Strength Training,3.8,3.9,7.0,7.0,3.8,7.5,7.0,7.0,6.0,5.0,4.5
oR7O9LW,Barbell Squat (On Knees),3,barbell,quads,"glutes, hamstrings, calves",upper legs,4,https://static.exercisedb.dev/media/oR7O9LW.gif,"Step:1 Start by kneeling on the ground with your knees hip-width apart and your toes pointing forward. | Step:2 Place a barbell across your shoulders, gripping it with an overhand grip and your hands slightly wider than shoulder-width apart. | Step:3 Engage your core and keep your chest lifted as you slowly lower your body down by bending your knees, keeping your back straight. | Step:4 Continue lowering until your thighs are parallel to the ground, or as low as you can comfortably go. | Step:5 Pause for a moment at the bottom, then push through your heels to return to the starting position. | Step:6 Repeat for the desired number of repetitions.",0.0,8.5,7.5,0.0,8.0,6.0,0.0,0.0,0.0,9.0,Strength Training,3.8,3.9,7.0,7.0,3.8,5.0,7.0,7.0,7.0,6.0,4.5
SJAA2IQ,Barbell Palms Up Wrist Curl Over A Bench,1,barbell,forearms,"biceps, shoulders",lower arms,3,https://static.exercisedb.dev/media/SJAA2IQ.gif,"Step:1 Sit on a bench with your feet flat on the ground and hold a barbell with an underhand grip, palms facing up. | Step:2 Rest your forearms on the bench, allowing your wrists to hang off the edge. | Step:3 Keeping your forearms stationary, exhale and curl your wrists upwards as far as possible. | Step:4 Hold the contracted position for a brief pause, then inhale and slowly lower the barbell back to the starting position. | Step:5 Repeat for the desired number of repetitions.",0.0,8.5,7.5,0.0,8.0,6.0,0.0,0.0,0.0,9.0,Strength Training,3.8,3.9,7.0,7.0,3.8,7.0,7.0,5.0,4.0,4.0,4.5
vAwm6rK,Cable Press On Exercise Ball,2,cable,pectorals,"shoulders, triceps",chest,3,https://static.exercisedb.dev/media/vAwm6rK.gif,"Step:1 Sit on an exercise ball with your feet flat on the ground and your knees at a 90-degree angle. | Step:2 Hold the cable handles at chest height with your palms facing down and your elbows bent. | Step:3 Engage your core and press the cable handles forward until your arms are fully extended. | Step:4 Pause for a moment, then slowly release the tension and bring the cable handles back to the starting position. | Step:5 Repeat for the desired number of repetitions.",0.0,8.5,7.5,0.0,8.0,6.0,0.0,0.0,0.0,9.0,Strength Training,3.8,3.9,7.0,7.0,3.8,6.0,8.0,6.0,6.0,4.0,4.5
EcaV7aL,Barbell Lying Close-Grip Press,3,barbell,triceps,"chest, shoulders",upper arms,3,https://static.exercisedb.dev/media/EcaV7aL.gif,"Step:1 Lie flat on a bench with your feet flat on the ground and your back pressed against the bench. | Step:2 Grasp the barbell with a close grip, hands shoulder-width apart, palms facing towards your feet. | Step:3 Lift the barbell off the rack and hold it directly above your chest with your arms fully extended. | Step:4 Slowly lower the barbell towards your chest, keeping your elbows close to your body. | Step:5 Pause for a moment when the barbell touches your chest, then push it back up to the starting position. | Step:6 Repeat for the desired number of repetitions.",0.0,8.5,7.5,0.0,8.0,6.0,0.0,0.0,0.0,9.0,Strength Training,3.8,3.9,7.0,7.0,3.8,5.0,7.0,7.0,7.0,6.0,4.5
ykHcWme,Sled Calf Press On Leg Press,2,sled machine,calves,"hamstrings, quadriceps",lower legs,3,https://static.exercisedb.dev/media/ykHcWme.gif,"Step:1 Adjust the seat of the leg press machine so that your knees are slightly bent when your feet are on the sled. | Step:2 Place your feet shoulder-width apart on the sled, with your toes pointing forward. | Step:3 Release the safety handles and push the sled away from you by extending your knees and ankles. | Step:4 Pause for a moment at the top of the movement, then slowly lower the sled back down by bending your knees and ankles. | Step:5 Repeat for the desired number of repetitions.",0.0,8.5,7.5,0.0,8.0,6.0,0.0,0.0,0.0,9.0,Strength Training,3.8,3.9,7.0,7.0,3.8,7.0,8.0,6.0,5.0,3.0,4.5
euI1BwR,Barbell Speed Squat,3,barbell,glutes,"quadriceps, hamstrings, calves",upper legs,4,https://static.exercisedb.dev/media/euI1BwR.gif,"Step:1 Stand with your feet shoulder-width apart, toes slightly turned out. | Step:2 Hold the barbell across your upper back, resting it on your traps or rear delts. | Step:3 Engage your core and keep your chest up as you lower your hips back and down, as if sitting into a chair. | Step:4 Lower until your thighs are parallel to the ground, or as low as you can comfortably go. | Step:5 Drive through your heels to stand back up, squeezing your glutes at the top. | Step:6 Repeat for the desired number of repetitions.",0.0,8.5,7.5,0.0,8.0,6.0,0.0,0.0,0.0,9.0,Strength Training,3.8,3.9,7.0,7.0,3.8,5.0,7.0,7.0,7.0,6.0,4.5
rDAiRf9,Dumbbell Incline One Arm Press,2,dumbbell,pectorals,"shoulders, triceps",chest,3,https://static.exercisedb.dev/media/rDAiRf9.gif,"Step:1 Sit on an incline bench with a dumbbell in one hand, resting on your thigh. | Step:2 Lie back on the bench and position the dumbbell at shoulder level, palm facing forward. | Step:3 Press the dumbbell upward and slightly inward, extending your arm fully. | Step:4 Pause for a moment at the top, then slowly lower the dumbbell back to the starting position. | Step:5 Repeat for the desired number of repetitions, then switch to the other arm.",0.0,8.5,7.5,0.0,8.0,6.0,0.0,0.0,0.0,9.0,Strength Training,3.8,3.9,7.0,7.0,3.8,8.5,8.0,6.0,5.0,3.0,4.5
9Tkqa9O,Kettlebell Windmill,3,kettlebell,abs,"obliques, shoulders",waist,3,https://static.exercisedb.dev/media/9Tkqa9O.gif,"Step:1 Stand with your feet shoulder-width apart, holding a kettlebell in your right hand overhead. | Step:2 Rotate your left foot outwards about 45 degrees and keep your right foot pointing forward. | Step:3 Bend your torso to the left side, keeping your right arm extended overhead and your eyes on the kettlebell. | Step:4 Lower your torso as far as you can while keeping your right arm straight and your left arm extended to the side. | Step:5 Pause for a moment, then return to the starting position by pushing through your right foot and engaging your obliques. | Step:6 Repeat for the desired number of repetitions, then switch sides.",0.0,8.5,7.5,0.0,8.0,6.0,0.0,0.0,0.0,9.0,Strength Training,3.8,3.9,7.0,7.0,3.8,7.5,7.0,7.0,6.0,5.0,4.5
cALkHHX,Dumbbell Iron Cross,2,dumbbell,delts,"triceps, chest",shoulders,3,https://static.exercisedb.dev/media/cALkHHX.gif,"Step:1 Stand with your feet shoulder-width apart, holding a dumbbell in each hand at your sides. | Step:2 Raise your arms out to the sides until they are parallel to the ground, forming a T shape with your body. | Step:3 Pause for a moment, then slowly lower your arms back down to the starting position. | Step:4 Repeat for the desired number of repetitions.",0.0,8.5,7.5,0.0,8.0,6.0,0.0,0.0,0.0,9.0,Strength Training,3.8,3.9,7.0,7.0,3.8,8.5,8.0,6.0,5.0,3.0,4.5
